title,year,letterboxd_rating,box_office,imdb_rating,genre,director,plot,runtime,country,is_underperformer,box_office_millions,rating_differential,underperformance_category,key_insights,genre_pattern,marketing_assessment
Portrait of a Lady on Fire,2019,4.5,3759854,8.0,"Drama, Romance",Céline Sciamma,"On an isolated island in Brittany at the end of the eighteenth century, a female painter is obliged to paint a wedding portrait of a young woman.",122 min,France,True,3.76,-3.5,Niche Appeal,"Portrait of a Lady on Fire is a masterclass in visual storytelling and restrained emotion, using its painterly cinematography and deliberate pacing to explore themes of female gaze and desire with profound intimacy. Its commercial underperformance stems from its slow-burn, dialogue-light approach and subtitled arthouse nature, yet it has resonated deeply as a landmark in queer cinema for its authentic representation and artistic integrity.",Prestige Picture,"The primary marketing challenge is overcoming the language barrier and niche appeal of a slow-burn, subtitled period drama to attract a broader audience beyond art-house enthusiasts."
The Handmaiden,2016,4.4,2006788,8.1,"Drama, Romance, Thriller",Park Chan-wook,"In 1930s Korea, a girl is hired as a handmaiden to a Japanese heiress who lives a secluded life on a countryside estate. But the maid has a secret: She is a pickpocket recruited by a swindler to help seduce the Lady and steal her ...",145 min,South Korea,True,2.01,-3.6999999999999993,Niche Appeal,"The Handmaiden is a masterclass in subversive storytelling, blending lush cinematography with intricate narrative twists that challenge genre conventions and cultural taboos. Its layered exploration of female agency, desire, and deception resonates deeply with audiences, though its explicit themes and non-English dialogue limited mainstream appeal. The film’s artistic audacity and emotional depth have cemented its status as a cult classic among cinephiles.",Prestige Picture,"The primary marketing challenge is overcoming language and cultural barriers to appeal to international audiences, compounded by the lack of recognizable star power to draw broader viewership."
Her,2013,4.3,25568251,8.0,"Drama, Romance, Sci-Fi",Spike Jonze,"In the near future, a lonely writer develops an unlikely relationship with an operating system designed to meet his every need.",126 min,United States,True,25.57,-3.7,Niche Appeal,"Her is a poignant exploration of modern loneliness and human connection, elevated by its sensitive direction, nuanced performances, and a deeply empathetic screenplay. Its unique premise and emotional depth have earned it a cult following and critical acclaim, resonating with audiences who value introspective storytelling over mainstream appeal.",Cult Potential,"The primary marketing challenge is the lack of star power to anchor the film's high-concept, introspective narrative, making it difficult to attract mainstream audiences without relying heavily on critical acclaim and word-of-mouth."
Moonlight,2016,4.3,27854932,7.4,Drama,Barry Jenkins,"A young African-American man grapples with his identity and sexuality while experiencing the everyday struggles of childhood, adolescence, and burgeoning adulthood.",111 min,United States,True,27.85,-3.1000000000000005,Niche Appeal,"Moonlight's profound artistic merit lies in its poetic and intimate portrayal of Black masculinity and queer identity, breaking new ground in representation with its nuanced storytelling and visual lyricism. Its cultural impact is monumental, offering a rare, authentic narrative that resonated deeply with critics and marginalized audiences, even if it didn't achieve blockbuster success. The film’s unique structure and emotional depth elevate it beyond conventional cinema, making it a timeless and essential work.",Prestige Picture,Lack of star power and a niche narrative focusing on a marginalized protagonist may limit mainstream appeal and broad audience reach.
The Lighthouse,2019,4.2,10867104,7.4,"Drama, Fantasy, Horror",Robert Eggers,Two lighthouse keepers try to maintain their sanity while living on a remote and mysterious New England island in the 1890s.,109 min,"Canada, United States",True,10.87,-3.2,Niche Appeal,"The Lighthouse is a masterclass in atmospheric tension and psychological horror, elevated by its stark black-and-white cinematography and powerhouse performances from Willem Dafoe and Robert Pattinson. Its commercial obscurity stems from its challenging, surreal narrative and niche appeal, yet it has garnered a cult following for its bold artistic vision and haunting exploration of isolation and madness.",Cult Potential,"The primary marketing challenge is the lack of recognizable star power, which limits broad audience appeal and complicates efforts to generate mainstream interest or secure wide theatrical distribution."
Columbus,2017,4.2,1017107,7.2,Drama,Kogonada,"A Korean-born man finds himself stuck in Columbus, Indiana, where his architect father is in a coma. The man meets a young woman who wants to stay in Columbus with her mother, a recovering addict, instead of pursuing her own dreams.",100 min,United States,True,1.02,-3.0,Niche Appeal,"Columbus captivates through its meditative pacing and stunning architectural backdrop, which serve as a metaphor for the characters' emotional landscapes. Its quiet, introspective storytelling and nuanced performances resonate deeply with critics and cinephiles, offering a rare, thoughtful exploration of connection and place. Despite its limited commercial reach, it stands as a masterclass in visual poetry and intimate drama.",Prestige Picture,"The primary marketing challenge is the lack of recognizable actors, which limits built-in audience appeal and makes it difficult to generate buzz or secure wide distribution."
Phantom Thread,2017,4.2,21198205,7.4,"Drama, Romance",Paul Thomas Anderson,"Set in 1950s London, Reynolds Woodcock is a renowned dressmaker whose fastidious life is disrupted by a young, strong-willed woman, Alma, who becomes his muse and lover.",130 min,"United States, China",True,21.2,-3.2,Niche Appeal,"Phantom Thread is a masterclass in meticulous craftsmanship, from its sumptuous visuals and intricate score to its nuanced exploration of power dynamics in relationships. Its deliberate pacing and subtle narrative, while alienating mainstream audiences, offer a rich, layered experience that rewards patient viewers with profound emotional and psychological depth.",Prestige Picture,"The primary marketing challenge is the lack of recognizable star power and a potentially niche, arthouse narrative, which may limit broad audience appeal despite critical acclaim."
Arrival,2016,4.2,100546139,7.9,"Drama, Mystery, Sci-Fi",Denis Villeneuve,"Linguist Louise Banks leads a team of investigators when gigantic spaceships touch down around the world. As nations teeter on the verge of global war, Banks and her crew must find a way to communicate with the extraterrestrial vi...",116 min,"United States, Canada",False,100.55,-3.7,Performed Well,Successful box office,,
The Master,2012,4.1,16377274,7.1,Drama,Paul Thomas Anderson,A Naval veteran arrives home from war unsettled and uncertain of his future - until he is tantalized by a cult and its charismatic leader.,138 min,United States,True,16.38,-3.0,Niche Appeal,"The Master is a hidden gem due to Paul Thomas Anderson's masterful direction and the powerhouse performances from Joaquin Phoenix and Philip Seymour Hoffman, which explore complex themes of identity and manipulation with profound depth. Its challenging, non-linear narrative and psychological intensity, while alienating to mainstream audiences, have cemented its status as a critically revered work of art.",Prestige Picture,"The primary marketing challenge is the lack of recognizable star power, which limits built-in audience appeal and complicates efforts to generate broad awareness and interest."
Paterson,2016,4.1,2152738,7.3,"Comedy, Drama, Romance",Jim Jarmusch,"A quiet observation of the triumphs and defeats of daily life, along with the poetry evident in its smallest details.",118 min,"France, Germany, United States",True,2.15,-3.2,Niche Appeal,"Paterson excels in its meditative, minimalist portrayal of everyday beauty, celebrating the quiet poetry in mundane routines. Its lack of commercial success stems from its deliberate, unhurried pacing and introspective nature, which defy mainstream expectations. Yet, its artistic sincerity and profound humanism resonate deeply with viewers who value contemplative cinema.",Prestige Picture,"The primary marketing challenge is the lack of recognizable star power and a niche, meditative narrative, which may hinder broad audience appeal and require a highly targeted, platform-based release strategy."
First Reformed,2017,4.1,3448256,7.1,"Drama, Mystery, Thriller",Paul Schrader,"A minister of a small congregation in upstate New York grapples with mounting despair brought on by tragedy, worldly concerns and a tormented past.",113 min,"United States, United Kingdom, Australia",True,3.45,-3.0,Niche Appeal,"First Reformed is a profound and austere character study that masterfully explores themes of faith, despair, and environmental crisis with unflinching honesty. Its slow-burn intensity and philosophical depth, anchored by Ethan Hawke’s haunting performance, resonate deeply with critics and cinephiles but challenge mainstream audiences. This combination of artistic rigor and thematic weight makes it a revered, if underseen, modern masterpiece.",Prestige Picture,"Lack of recognizable star power limits broad appeal and complicates generating mainstream awareness for this niche, thematically heavy drama."
Enemy,2013,4.0,1008726,6.9,"Drama, Mystery, Thriller",Denis Villeneuve,A mild-mannered college professor investigates the life of an actor who looks exactly like him.,91 min,"Canada, Spain, France",True,1.01,-2.9000000000000004,Niche Appeal,"Enemy captivates with its surreal, layered narrative and psychological depth, exploring themes of identity and duality through a haunting, symbolic lens. Its deliberate ambiguity and atmospheric tension offer a rich, interpretive experience that rewards repeat viewings, cementing its status as a cult favorite among cinephiles.",Prestige Picture,"The primary marketing challenge is the lack of recognizable star power, which limits broad audience appeal and complicates efforts to generate mainstream interest or secure wide distribution."
Under the Skin,2013,4.0,2614251,6.3,"Drama, Horror, Mystery",Jonathan Glazer,"A mysterious young woman seduces lonely men in the evening hours in Scotland. However, events lead her to begin a process of self-discovery.",108 min,"United Kingdom, Switzerland, United States",True,2.61,-2.3,Niche Appeal,"Under the Skin is celebrated for its haunting, minimalist style and Scarlett Johansson’s unsettling performance, using surreal horror to explore themes of humanity and alienation. Its deliberate ambiguity and experimental narrative challenge viewers, earning it a cult following despite its niche appeal and limited box office reach.",Cult Potential,"The primary marketing challenge is the film's abstract, slow-burning narrative and lack of star power, making it difficult to attract a mainstream audience without a clear, accessible hook."
Swiss Army Man,2016,4.0,4210454,6.9,"Comedy, Drama, Fantasy","Daniel Kwan, Daniel Scheinert","A hopeless man stranded on a deserted island befriends a dead body, and together they go on a surreal journey to get home.",97 min,United States,True,4.21,-2.9000000000000004,Niche Appeal,"Swiss Army Man is a daringly original film that blends absurdist humor with profound emotional depth, using its bizarre premise to explore themes of loneliness and human connection. Its unique visual style and heartfelt performances create an unexpectedly moving experience that resonates deeply with niche audiences, earning it a cult following despite its unconventional nature.",Cult Potential,"The primary marketing challenge is the bizarre and potentially off-putting premise (a stranded man befriends a flatulent corpse), which makes it difficult to identify and appeal to a mainstream audience without alienating viewers."
The Lobster,2015,4.0,9077245,7.1,"Drama, Romance, Sci-Fi",Yorgos Lanthimos,"In a dystopian near future, according to the laws of The City, single people are taken to The Hotel, where they are obliged to find a romantic partner in 45 days or they're transformed into beasts and sent off into The Woods.",119 min,"Ireland, United Kingdom, Greece, France, Netherlands, United States, Belgium",True,9.08,-3.0999999999999996,Niche Appeal,"The Lobster stands out as a hidden gem due to its brilliantly absurd and darkly satirical take on societal pressures around relationships, blending deadpan humor with poignant commentary. Its unique narrative structure and surreal aesthetic challenge conventional storytelling, earning a cult following and critical acclaim for its originality and intellectual depth. Despite its niche appeal limiting box office success, it has left a lasting cultural impact by redefining the boundaries of romantic and dystopian cinema.",Cult Potential,"The primary marketing challenge is the film's unconventional premise and darkly satirical tone, which may alienate mainstream audiences and complicate clear target audience identification."
Good Time,2017,4.0,2026499,7.3,"Crime, Drama, Thriller","Benny Safdie, Josh Safdie","After a botched bank robbery lands his younger brother in prison, Connie Nikas embarks on a twisted odyssey through New York City's underworld to get his brother Nick out of jail.",102 min,United States,True,2.03,-3.3,Limited Release,"Good Time excels through its raw, kinetic energy and Robert Pattinson's transformative performance, immersing viewers in a gritty, neon-soaked New York underworld. Its artistic merit lies in the Safdie brothers' masterful tension-building and unflinching character study, which resonated deeply with critics and cinephiles but remained too intense and niche for mainstream appeal.",Prestige Picture,"The primary marketing challenge is the lack of recognizable star power, which limits built-in audience appeal and complicates efforts to attract mainstream viewers to an otherwise niche, gritty thriller."
The Killing of a Sacred Deer,2017,4.0,2291901,7.0,"Drama, Horror, Mystery",Yorgos Lanthimos,"Steven, a charismatic surgeon, is forced to make an unthinkable sacrifice after his life starts to fall apart, when the behavior of a teenage boy he has taken under his wing turns sinister.",121 min,"Ireland, United Kingdom, United States",True,2.29,-3.0,Niche Appeal,"The Killing of a Sacred Deer stands out for its unnerving, clinical direction and masterful blend of psychological horror with Greek tragedy, creating a uniquely unsettling atmosphere. Its deliberate pacing and stark, unsettling performances challenge conventional narrative expectations, appealing to niche audiences who appreciate its bold, allegorical depth. This artistic audacity, while limiting mainstream appeal, cements its status as a cult favorite among cinephiles.",Prestige Picture,"The primary marketing challenge is the film's ambiguous and unsettling tone, which makes it difficult to identify and appeal to a broad target audience beyond niche arthouse viewers."
A Ghost Story,2017,4.0,1596371,6.8,"Drama, Fantasy, Mystery",David Lowery,"In this singular exploration of legacy, love, loss, and the enormity of existence, a recently deceased, white-sheeted ghost returns to his suburban home to try to reconnect with his bereft wife.",92 min,United States,True,1.6,-2.8,Niche Appeal,"A Ghost Story is a profound meditation on grief and time, conveyed through its minimalist, patient storytelling and haunting visual poetry. Its unconventional narrative structure and lingering, meditative pace offer a deeply emotional experience that resonates with niche audiences, prioritizing artistic expression over mainstream appeal. This bold approach cements its status as a cult favorite among cinephiles, despite its limited commercial reach.",Cult Potential,"The primary marketing challenge is the lack of star power and a clear target audience, making it difficult to generate mainstream awareness and appeal beyond niche art-house viewers."
Silence,2016,4.0,7100177,7.2,"Drama, History",Martin Scorsese,"In the 17th century, two Portuguese Jesuit priests travel to Japan in an attempt to locate their mentor, who is rumored to have committed apostasy, and to propagate Catholicism.",161 min,"United States, United Kingdom, Italy, Taiwan, Mexico, Japan",True,7.1,-3.2,Niche Appeal,"Silence stands out for its profound and meditative exploration of faith, doubt, and sacrifice, masterfully directed by Martin Scorsese with stunning cinematography and powerful performances. Its commercial underperformance is likely due to its demanding, slow-paced narrative and heavy thematic weight, which appeal more to cinephiles and critics than mainstream audiences.",Prestige Picture,"The primary marketing challenge is the film's lengthy runtime and potentially heavy, niche subject matter, which may deter mainstream audiences despite its artistic merit."
Annihilation,2018,4.0,32732301,6.8,"Adventure, Drama, Horror",Alex Garland,"A biologist signs up for a dangerous, secret expedition in which the laws of nature don't apply.",115 min,"United States, United Kingdom",True,32.73,-2.8,Niche Appeal,"Annihilation is a visually stunning and intellectually provocative film that masterfully blends cosmic horror with deep psychological themes, creating a haunting allegory for self-destruction and transformation. Its commercial underperformance stems from its challenging, non-linear narrative and cerebral approach, which alienated mainstream audiences but cemented its status as a cult classic celebrated for its ambition and artistry.",Cult Potential,"The primary marketing challenge is the film's cerebral and ambiguous nature, which makes it difficult to clearly identify and appeal to a broad target audience beyond niche sci-fi fans."
