title,year,letterboxd_rating,source_url,slug,letterboxd_url,box_office,budget,imdb_rating,genre,director,actors,plot,awards,runtime,country,language,is_underperformer,box_office_millions,budget_millions,roi,rating_differential,decade,decade_label
Little Women,2019,4.2,https://letterboxd.com/jack/list/official-top-250-films-with-the-most-fans/,little-women,https://letterboxd.com/film/little-women/,108101214,0,7.8,"Drama, Romance",Greta Gerwig,"Saoirse Ronan, Emma Watson, Florence Pugh","In 19th century Massachusetts, the March sisters--Meg, Jo, Beth, and Amy--on the threshold of womanhood, go through many ups and downs in life and endeavor to make important decisions about their futu",Won 1 Oscar. 73 wins & 230 nominations total,135 min,United States,"English, French",False,108.1,0.0,,-3.6,2010,2010s
Fight Club,1999,4.2,https://letterboxd.com/jack/list/official-top-250-films-with-the-most-fans/,fight-club,https://letterboxd.com/film/fight-club/,37030102,0,8.8,"Crime, Drama, Thriller",David Fincher,"Brad Pitt, Edward Norton, Meat Loaf",An insomniac office worker and a devil-may-care soap maker form an underground fight club that evolves into much more.,Nominated for 1 Oscar. 12 wins & 38 nominations total,139 min,"United States, Germany",English,True,37.03,0.0,,-4.6,1990,1990s
La La Land,2016,4.2,https://letterboxd.com/jack/list/official-top-250-films-with-the-most-fans/,la-la-land,https://letterboxd.com/film/la-la-land/,151101803,0,8.0,"Comedy, Drama, Music",Damien Chazelle,"Ryan Gosling, Emma Stone, Rosemarie DeWitt","When Sebastian, a pianist, and Mia, an actress, follow their passion and achieve success in their respective fields, they find themselves torn between their love for each other and their careers.",Won 6 Oscars. 242 wins & 307 nominations total,128 min,"United States, Hong Kong","English, Cantonese",False,151.1,0.0,,-3.8,2010,2010s
Eternal Sunshine of the Spotless Mind,2004,4.2,https://letterboxd.com/jack/list/official-top-250-films-with-the-most-fans/,eternal-sunshine-of-the-spotless-mind,https://letterboxd.com/film/eternal-sunshine-of-the-spotless-mind/,34400301,0,8.3,"Drama, Romance, Sci-Fi",Michel Gondry,"Jim Carrey, Kate Winslet, Tom Wilkinson","When their relationship turns sour, a couple undergoes a medical procedure to have each other erased from their memories forever.",Won 1 Oscar. 73 wins & 111 nominations total,108 min,United States,English,True,34.4,0.0,,-4.1,2000,2000s
The Conjuring,2013,4.0,https://letterboxd.com/films/,the-conjuring,https://letterboxd.com/film/the-conjuring/,137446368,0,7.5,"Horror, Mystery, Thriller",James Wan,"Patrick Wilson, Vera Farmiga, Ron Livingston",Paranormal investigators Ed and Lorraine Warren work to help a family terrorized by a dark presence in their farmhouse.,15 wins & 22 nominations total,112 min,United States,"English, Latin",False,137.45,0.0,,-3.5,2010,2010s
Sydney🚀,2007,4.0,https://letterboxd.com/films/,sydney,https://letterboxd.com/film/sydney/,11892415,0,6.2,"Comedy, Drama, Romance",Joe Nussbaum,"Amanda Bynes, Sara Paxton, Matt Long","After being banished from the most popular sorority on campus, Sydney White teams up with a group of socially awkward outcasts to outdo the queen at her own game.",N/A,108 min,United States,English,True,11.89,0.0,,-2.2,2000,2000s
Together,2000,4.0,https://letterboxd.com/films/,together,https://letterboxd.com/film/together/,1034829,0,7.4,"Comedy, Drama, Romance",Lukas Moodysson,"Lisa Lindgren, Michael Nyqvist, Emma Samuelsson","In 1975, the dynamics of a Swedish commune begin to change upon the arrival of a beaten wife and her two kids.",15 wins & 16 nominations,106 min,"Sweden, Denmark, Italy",Swedish,True,1.03,0.0,,-3.4,2000,2000s
Good Will Hunting,1997,4.0,https://letterboxd.com/films/,good-will-hunting,https://letterboxd.com/film/good-will-hunting/,138433435,0,8.3,"Drama, Romance",Gus Van Sant,"Robin Williams, Matt Damon, Ben Affleck","A therapist counsels Will Hunting, a janitor with a genius IQ.",Won 2 Oscars. 25 wins & 61 nominations total,126 min,United States,English,False,138.43,0.0,,-4.3,1990,1990s
Dead Poets Society,1989,4.0,https://letterboxd.com/films/,dead-poets-society,https://letterboxd.com/film/dead-poets-society/,95860116,0,8.1,"Comedy, Drama",Peter Weir,"Robin Williams, Robert Sean Leonard, Ethan Hawke","Maverick teacher John Keating returns in 1959 to the prestigious New England boys' boarding school where he was once a star student, using poetry to embolden his pupils to new heights of self-expressi",Won 1 Oscar. 20 wins & 19 nominations total,128 min,United States,"English, Latin, French",False,95.86,0.0,,-4.1,1980,1980s
