title,year,letterboxd_rating,source_url,slug,letterboxd_url,box_office,budget,imdb_rating,genre,director,actors,plot,awards,runtime,country,language,is_underperformer,box_office_millions,budget_millions,roi,rating_differential,decade,decade_label
Andrei Rublev,1966,4.3,https://letterboxd.com/dave/list/official-top-250-narrative-feature-films/,andrei-rublev,https://letterboxd.com/film/andrei-rublev/,124189,0,8.0,"Biography, Drama, History",Andrei Tarkovsky,"Anatoliy Solonitsyn, Ivan Lapikov, Nikolay Grinko","The life, times and afflictions of the fifteenth-century Russian iconographer St. Andrei Rublev.",4 wins & 1 nomination total,189 min,Soviet Union,"Russian, Italian, Tatar",True,0.12,0.0,,-3.7,1960,1960s
Apocalypse Now,1979,4.3,https://letterboxd.com/dave/list/official-top-250-narrative-feature-films/,apocalypse-now,https://letterboxd.com/film/apocalypse-now/,96074376,0,8.4,"Drama, Mystery, War",Francis Ford Coppola,"Martin Sheen, Marlon Brando, Robert Duvall",A U.S. Army officer serving in Vietnam is tasked with assassinating a renegade Special Forces Colonel who sees himself as a god.,Won 2 Oscars. 21 wins & 33 nominations total,147 min,United States,"English, French, Vietnamese",False,96.07,0.0,,-4.1,1970,1970s
The Dark Knight,2008,4.3,https://letterboxd.com/dave/list/official-top-250-narrative-feature-films/,the-dark-knight,https://letterboxd.com/film/the-dark-knight/,534987076,0,9.1,"Action, Crime, Drama",Christopher Nolan,"Christian Bale, Heath Ledger, Aaron Eckhart","When a menace known as the Joker wreaks havoc and chaos on the people of Gotham, Batman, James Gordon and Harvey Dent must work together to put an end to the madness.",Won 2 Oscars. 163 wins & 165 nominations total,152 min,"United States, United Kingdom","English, Mandarin",False,534.99,0.0,,-4.8,2000,2000s
Neon Genesis Evangelion: The End of Evangelion,1997,4.3,https://letterboxd.com/dave/list/official-top-250-narrative-feature-films/,neon-genesis-evangelion-the-end-of-evangelion,https://letterboxd.com/film/neon-genesis-evangelion-the-end-of-evangelion/,1302300,0,8.1,"Animation, Action, Drama","Hideaki Anno, Kazuya Tsurumaki","Megumi Ogata, Megumi Hayashibara, Yûko Miyamura",Concurrent theatrical ending of the TV series Neon Genesis Evangelion (1995).,2 wins total,87 min,Japan,Japanese,True,1.3,0.0,,-3.8,1990,1990s
GoodFellas,1990,4.3,https://letterboxd.com/dave/list/official-top-250-narrative-feature-films/,goodfellas,https://letterboxd.com/film/goodfellas/,46909721,0,8.7,"Biography, Crime, Drama",Martin Scorsese,"Robert De Niro, Ray Liotta, Joe Pesci","The story of Henry Hill and his life in the mafia, covering his relationship with his wife Karen and his mob partners Jimmy Conway and Tommy DeVito.",Won 1 Oscar. 44 wins & 38 nominations total,145 min,United States,"English, Italian, Hebrew, Yiddish",True,46.91,0.0,,-4.4,1990,1990s
Spirited Away,2001,4.3,https://letterboxd.com/dave/list/official-top-250-narrative-feature-films/,spirited-away,https://letterboxd.com/film/spirited-away/,15205725,0,8.6,"Animation, Adventure, Family",Hayao Miyazaki,"Daveigh Chase, Suzanne Pleshette, Miyu Irino","During her family's move to the suburbs, a sullen 10-year-old girl wanders into a world ruled by gods, witches and spirits, and where humans are changed into beasts.",Won 1 Oscar. 58 wins & 31 nominations total,124 min,"Japan, United States","Japanese, English",True,15.21,0.0,,-4.3,2000,2000s
There Will Be Blood,2007,4.3,https://letterboxd.com/dave/list/official-top-250-narrative-feature-films/,there-will-be-blood,https://letterboxd.com/film/there-will-be-blood/,40222514,0,8.2,Drama,Paul Thomas Anderson,"Daniel Day-Lewis, Paul Dano, Ciarán Hinds","A story of family, religion, hatred, oil and madness, focusing on a turn-of-the-century prospector in the early days of the business.",Won 2 Oscars. 114 wins & 138 nominations total,158 min,United States,"English, American Sign ",True,40.22,0.0,,-3.9,2000,2000s
The Cranes Are Flying,1957,4.3,https://letterboxd.com/dave/list/official-top-250-narrative-feature-films/,the-cranes-are-flying,https://letterboxd.com/film/the-cranes-are-flying/,17923,0,8.3,"Drama, Romance, War",Mikhail Kalatozov,"Tatyana Samoylova, Aleksey Batalov, Vasiliy Merkurev","Veronica plans a rendezvous with her lover, Boris, at the bank of river, only for him to be drafted into World War II shortly thereafter.",Nominated for 2 BAFTA 4 wins & 3 nominations total,95 min,Soviet Union,Russian,True,0.02,0.0,,-4.0,1950,1950s
The Apartment,1960,4.3,https://letterboxd.com/dave/list/official-top-250-narrative-feature-films/,the-apartment,https://letterboxd.com/film/the-apartment/,18600000,0,8.3,"Comedy, Drama, Romance",Billy Wilder,"Jack Lemmon, Shirley MacLaine, Fred MacMurray","A Manhattan insurance clerk tries to rise in his company by letting its executives use his apartment for trysts, but office politics and his own romantic hopes complicate matters.",Won 5 Oscars. 25 wins & 8 nominations total,125 min,United States,English,True,18.6,0.0,,-4.0,1960,1960s
Incendies,2010,4.3,https://letterboxd.com/dave/list/official-top-250-narrative-feature-films/,incendies,https://letterboxd.com/film/incendies/,2071334,0,8.3,"Drama, Mystery, War",Denis Villeneuve,"Lubna Azabal, Mélissa Désormeaux-Poulin, Maxim Gaudette",Twins journey to the Middle East to discover their family history and fulfill their mother's last wishes.,Nominated for 1 Oscar. 41 wins & 20 nominations total,131 min,"Canada, France","French, Arabic, English",True,2.07,0.0,,-4.0,2010,2010s
"The Good, the Bad and the Ugly",1966,4.3,https://letterboxd.com/dave/list/official-top-250-narrative-feature-films/,the-good-the-bad-and-the-ugly,https://letterboxd.com/film/the-good-the-bad-and-the-ugly/,25100000,0,8.8,"Adventure, Drama, Western",Sergio Leone,"Clint Eastwood, Eli Wallach, Lee Van Cleef",A bounty-hunting scam joins two men in an uneasy alliance against a third in a race to find a fortune in gold buried in a remote cemetery.,2 wins & 5 nominations total,178 min,"Italy, Spain, West Germany, United States","Italian, English",True,25.1,0.0,,-4.5,1960,1960s
Sunset Boulevard,1950,4.3,https://letterboxd.com/dave/list/official-top-250-narrative-feature-films/,sunset-boulevard,https://letterboxd.com/film/sunset-boulevard/,299645,0,8.4,"Drama, Film-Noir",Billy Wilder,"William Holden, Gloria Swanson, Erich von Stroheim",A screenwriter develops a dangerous relationship with a faded film star determined to make a triumphant return.,Won 3 Oscars. 21 wins & 20 nominations total,110 min,United States,English,True,0.3,0.0,,-4.1,1950,1950s
Interstellar,2014,4.3,https://letterboxd.com/dave/list/official-top-250-narrative-feature-films/,interstellar,https://letterboxd.com/film/interstellar/,203227580,0,8.7,"Adventure, Drama, Sci-Fi",Christopher Nolan,"Matthew McConaughey, Anne Hathaway, Jessica Chastain","When Earth becomes uninhabitable in the future, a farmer and ex-NASA pilot, Joseph Cooper, is tasked to pilot a spacecraft, along with a team of researchers, to find a new planet for humans.",Won 1 Oscar. 44 wins & 148 nominations total,169 min,"United States, United Kingdom, Canada",English,False,203.23,0.0,,-4.4,2010,2010s
The Passion of Joan of Arc,1928,4.3,https://letterboxd.com/dave/list/official-top-250-narrative-feature-films/,the-passion-of-joan-of-arc,https://letterboxd.com/film/the-passion-of-joan-of-arc/,21877,0,8.1,"Biography, Drama, History",Carl Theodor Dreyer,"Maria Falconetti, Eugene Silvain, André Berley","In 1431, Jeanne d'Arc is placed on trial on charges of heresy. The ecclesiastical jurists attempt to force Jeanne to recant her claims of holy visions.",4 wins & 1 nomination total,114 min,France,"None, French, Latin",True,0.02,0.0,,-3.8,1920,1920s
The Battle of Algiers,1966,4.3,https://letterboxd.com/dave/list/official-top-250-narrative-feature-films/,the-battle-of-algiers,https://letterboxd.com/film/the-battle-of-algiers/,879794,0,8.1,"Drama, War",Gillo Pontecorvo,"Brahim Hadjadj, Jean Martin, Yacef Saadi","In the 1950s, fear and violence escalate as the people of Algiers fight for independence from the French government.",Nominated for 3 Oscars. 9 wins & 8 nominations total,121 min,"Italy, Algeria","Arabic, French, English, Spanish",True,0.88,0.0,,-3.8,1960,1960s
I Am Cuba,1964,4.3,https://letterboxd.com/dave/list/official-top-250-narrative-feature-films/,i-am-cuba,https://letterboxd.com/film/i-am-cuba/,168100,0,8.2,Drama,Mikhail Kalatozov,"Sergio Corrieri, Salvador Wood, José Gallardo",Four vignettes about the lives of the Cuban people set during the pre-revolutionary era.,2 wins & 1 nomination total,141 min,"Cuba, Soviet Union","Spanish, English",True,0.17,0.0,,-3.9,1960,1960s
Whiplash,2014,4.3,https://letterboxd.com/dave/list/official-top-250-narrative-feature-films/,whiplash,https://letterboxd.com/film/whiplash/,14003391,0,8.5,"Drama, Music",Damien Chazelle,"Miles Teller, J.K. Simmons, Melissa Benoist",A promising young drummer enrolls at a cut-throat music conservatory where his dreams of greatness are mentored by an instructor who will stop at nothing to realize a student's potential.,Won 3 Oscars. 99 wins & 144 nominations total,106 min,United States,English,True,14.0,0.0,,-4.2,2010,2010s
Fanny and Alexander,1982,4.3,https://letterboxd.com/dave/list/official-top-250-narrative-feature-films/,fanny-and-alexander,https://letterboxd.com/film/fanny-and-alexander/,6783304,0,8.1,Drama,Ingmar Bergman,"Bertil Guve, Pernilla Allwin, Kristina Adolphson","Two young Swedish children in the 1900s experience the many comedies and tragedies of their lively and affectionate theatrical family, the Ekdahls.",Won 4 Oscars. 25 wins & 13 nominations total,188 min,"Sweden, France, West Germany","Swedish, German, Yiddish, English, French",True,6.78,0.0,,-3.8,1980,1980s
Cinema Paradiso,1988,4.3,https://letterboxd.com/dave/list/official-top-250-narrative-feature-films/,cinema-paradiso,https://letterboxd.com/film/cinema-paradiso/,12397210,0,8.5,"Drama, Romance",Giuseppe Tornatore,"Philippe Noiret, Enzo Cannavale, Antonella Attili","Salvatore, a famous film director, returns to his hometown for the funeral of the local theater's film projectionist, Alfredo. He reminisces about his life as a young boy falling in love with cinema.",Won 1 Oscar. 25 wins & 33 nominations total,174 min,"Italy, France",Italian,True,12.4,0.0,,-4.2,1980,1980s
Grave of the Fireflies,1988,4.3,https://letterboxd.com/dave/list/official-top-250-narrative-feature-films/,grave-of-the-fireflies,https://letterboxd.com/film/grave-of-the-fireflies/,516962,0,8.5,"Animation, Drama, War",Isao Takahata,"Tsutomu Tatsumi, Ayano Shiraishi, Akemi Yamaguchi",A young boy and his little sister struggle to survive in Japan during World War II.,3 wins total,88 min,Japan,Japanese,True,0.52,0.0,,-4.2,1980,1980s
La Haine,1995,4.3,https://letterboxd.com/dave/list/official-top-250-narrative-feature-films/,la-haine,https://letterboxd.com/film/la-haine/,280859,0,8.1,"Crime, Drama",Mathieu Kassovitz,"Vincent Cassel, Hubert Koundé, Saïd Taghmaoui",24 hours in the lives of three young men in the French suburbs the day after a violent riot.,8 wins & 15 nominations total,98 min,France,"French, Yiddish",True,0.28,0.0,,-3.8,1990,1990s
Yi Yi,2000,4.3,https://letterboxd.com/dave/list/official-top-250-narrative-feature-films/,yi-yi,https://letterboxd.com/film/yi-yi/,1136776,0,8.1,"Drama, Romance",Edward Yang,"Nien-Jen Wu, Elaine Jin, Issei Ogata",Each member of a middle-class Taipei family seeks to reconcile past and present relationships within their daily lives.,14 wins & 23 nominations total,173 min,"Taiwan, Japan","Mandarin, Min Nan, Hokkien, English, Japanese, French",True,1.14,0.0,,-3.8,2000,2000s
Seven Samurai,1954,4.3,https://letterboxd.com/dave/list/official-top-250-narrative-feature-films/,seven-samurai,https://letterboxd.com/film/seven-samurai/,820278,0,8.6,"Action, Drama",Akira Kurosawa,"Toshirô Mifune, Takashi Shimura, Keiko Tsushima","Farmers from a village exploited by bandits hire a veteran samurai for protection, and he gathers six other samurai to join him.",Nominated for 2 Oscars. 5 wins & 9 nominations total,207 min,Japan,Japanese,True,0.82,0.0,,-4.3,1950,1950s
Come and See,1985,4.3,https://letterboxd.com/dave/list/official-top-250-narrative-feature-films/,come-and-see,https://letterboxd.com/film/come-and-see/,71909,0,8.3,"Drama, Thriller, War",Elem Klimov,"Aleksey Kravchenko, Olga Mironova, Liubomiras Laucevicius","After finding an old rifle, a young boy joins the Soviet resistance movement against ruthless German forces and experiences the horrors of World War II.",3 wins total,142 min,Soviet Union,"Belarusian, Russian, German",True,0.07,0.0,,-4.0,1980,1980s
High and Low,1963,4.3,https://letterboxd.com/dave/list/official-top-250-narrative-feature-films/,high-and-low,https://letterboxd.com/film/high-and-low/,46808,0,8.4,"Crime, Drama, Mystery",Akira Kurosawa,"Toshirô Mifune, Yutaka Sada, Tatsuya Nakadai",An executive of a Yokohama shoe company becomes a victim of extortion when his chauffeur's son is kidnapped by mistake and held for ransom.,3 wins & 3 nominations total,143 min,Japan,Japanese,True,0.05,0.0,,-4.1,1960,1960s
Ikiru,1952,4.3,https://letterboxd.com/dave/list/official-top-250-narrative-feature-films/,ikiru,https://letterboxd.com/film/ikiru/,60239,0,8.3,Drama,Akira Kurosawa,"Takashi Shimura, Nobuo Kaneko, Shin'ichi Himori",A bureaucrat tries to find meaning in his life after he discovers he has terminal cancer.,Nominated for 1 BAFTA Award6 wins & 2 nominations total,143 min,Japan,"Japanese, Latin, English, French",True,0.06,0.0,,-4.0,1950,1950s
The Shawshank Redemption,1994,4.3,https://letterboxd.com/dave/list/official-top-250-narrative-feature-films/,the-shawshank-redemption,https://letterboxd.com/film/the-shawshank-redemption/,28767189,0,9.3,Drama,Frank Darabont,"Tim Robbins, Morgan Freeman, Bob Gunton","A banker convicted of uxoricide forms a friendship over a quarter century with a hardened convict, while maintaining his innocence and trying to remain hopeful through simple compassion.",Nominated for 7 Oscars. 21 wins & 42 nominations total,142 min,United States,English,True,28.77,0.0,,-5.0,1990,1990s
City of God,2002,4.3,https://letterboxd.com/dave/list/official-top-250-narrative-feature-films/,city-of-god,https://letterboxd.com/film/city-of-god/,7564459,0,8.6,"Crime, Drama","Fernando Meirelles, Kátia Lund","Alexandre Rodrigues, Leandro Firmino, Matheus Nachtergaele","In the slums of Rio, two kids' paths diverge as one struggles to become a photographer and the other a kingpin.",Nominated for 4 Oscars. 75 wins & 50 nominations total,130 min,"Brazil, France",Portuguese,True,7.56,0.0,,-4.3,2000,2000s
The Godfather Part II,1974,4.3,https://letterboxd.com/dave/list/official-top-250-narrative-feature-films/,the-godfather-part-ii,https://letterboxd.com/film/the-godfather-part-ii/,47834595,0,9.0,"Crime, Drama",Francis Ford Coppola,"Al Pacino, Robert De Niro, Robert Duvall","The early life and career of Vito Corleone in 1920s New York City is portrayed, while his son, Michael, expands and tightens his grip on the family crime syndicate.",Won 6 Oscars. 17 wins & 21 nominations total,202 min,United States,"English, Italian, Spanish, Latin, Sicilian",True,47.83,0.0,,-4.7,1970,1970s
Schindler's List,1993,4.3,https://letterboxd.com/dave/list/official-top-250-narrative-feature-films/,schindlers-list,https://letterboxd.com/film/schindlers-list/,96898818,0,9.0,"Biography, Drama, History",Steven Spielberg,"Liam Neeson, Ralph Fiennes, Ben Kingsley","In German-occupied Poland during World War II, industrialist Oskar Schindler gradually becomes concerned for his Jewish workforce after witnessing their persecution by the Nazis.",Won 7 Oscars. 91 wins & 49 nominations total,195 min,United States,"English, Hebrew, German, Polish, Latin",False,96.9,0.0,,-4.7,1990,1990s
The Lord of the Rings: The Return of the King,2003,4.3,https://letterboxd.com/dave/list/official-top-250-narrative-feature-films/,the-lord-of-the-rings-the-return-of-the-king,https://letterboxd.com/film/the-lord-of-the-rings-the-return-of-the-king/,381878219,0,9.0,"Adventure, Drama, Fantasy",Peter Jackson,"Elijah Wood, Viggo Mortensen, Ian McKellen",Gandalf and Aragorn lead the World of Men against Sauron's army to draw his gaze from Frodo and Sam as they approach Mount Doom with the One Ring.,Won 11 Oscars. 215 wins & 124 nominations total,201 min,"New Zealand, United States","English, Quenya, Old English, Sindarin",False,381.88,0.0,,-4.7,2000,2000s
Parasite,2019,4.3,https://letterboxd.com/dave/list/official-top-250-narrative-feature-films/,parasite,https://letterboxd.com/film/parasite/,53847897,0,8.5,"Drama, Thriller",Bong Joon Ho,"Song Kang-ho, Lee Sun-kyun, Cho Yeo-jeong",Greed and class discrimination threaten the newly formed symbiotic relationship between the wealthy Park family and the destitute Kim clan.,Won 4 Oscars. 309 wins & 260 nominations total,132 min,South Korea,"Korean, English",False,53.85,0.0,,-4.2,2010,2010s
The Godfather,1972,4.3,https://letterboxd.com/dave/list/official-top-250-narrative-feature-films/,the-godfather,https://letterboxd.com/film/the-godfather/,136381073,0,9.2,"Crime, Drama",Francis Ford Coppola,"Marlon Brando, Al Pacino, James Caan",The aging patriarch of an organized crime dynasty transfers control of his clandestine empire to his reluctant son.,Won 3 Oscars. 31 wins & 31 nominations total,175 min,United States,"English, Italian, Latin",False,136.38,0.0,,-4.9,1970,1970s
Ran,1985,4.3,https://letterboxd.com/dave/list/official-top-250-narrative-feature-films/,ran,https://letterboxd.com/film/ran/,4314927,0,8.2,"Action, Drama, War",Akira Kurosawa,"Tatsuya Nakadai, Akira Terao, Jinpachi Nezu","In Medieval Japan, an elderly warlord retires, handing over his empire to his three sons. However, he vastly underestimates how the new-found power will corrupt them and cause them to turn on each oth",Won 1 Oscar. 30 wins & 23 nominations total,160 min,"Japan, France",Japanese,True,4.31,0.0,,-3.9,1980,1980s
Se7en,1995,4.2,https://letterboxd.com/jack/list/official-top-250-films-with-the-most-fans/,se7en,https://letterboxd.com/film/se7en/,101040643,0,8.6,"Crime, Drama, Mystery",David Fincher,"Morgan Freeman, Brad Pitt, Kevin Spacey","Two detectives, a rookie and a veteran, hunt a serial killer who uses the seven deadly sins as his motives.",Nominated for 1 Oscar. 29 wins & 44 nominations total,127 min,United States,English,False,101.04,0.0,,-4.4,1990,1990s
Pride & Prejudice,2005,4.2,https://letterboxd.com/jack/list/official-top-250-films-with-the-most-fans/,pride-prejudice,https://letterboxd.com/film/pride-prejudice/,44785261,0,7.8,"Drama, Romance",Joe Wright,"Keira Knightley, Matthew Macfadyen, Brenda Blethyn","When Elizabeth Bennet meets the handsome Mr. Darcy, she believes he is the last man she could ever marry, but as their lives become intertwined, she finds herself captivated by the man she has sworn t",Nominated for 4 Oscars. 13 wins & 59 nominations total,129 min,"United Kingdom, France, United States",English,True,44.79,0.0,,-3.6,2000,2000s
Star Wars: Episode III – Revenge of the Sith,2005,4.2,https://letterboxd.com/jack/list/official-top-250-films-with-the-most-fans/,star-wars-episode-iii-revenge-of-the-sith,https://letterboxd.com/film/star-wars-episode-iii-revenge-of-the-sith/,414378291,0,7.6,"Action, Adventure, Fantasy",George Lucas,"Hayden Christensen, Natalie Portman, Ewan McGregor","As the Clone Wars nears its end, Obi-Wan Kenobi pursues a new threat, while Anakin Skywalker is lured by Chancellor Palpatine into a sinister plot for galactic domination.",Nominated for 1 Oscar. 29 wins & 64 nominations total,140 min,"United States, Italy, Switzerland, Thailand, United Kingdom",English,False,414.38,0.0,,-3.4,2000,2000s
Spider-Man: Into the Spider-Verse,2018,4.2,https://letterboxd.com/jack/list/official-top-250-films-with-the-most-fans/,spider-man-into-the-spider-verse,https://letterboxd.com/film/spider-man-into-the-spider-verse/,190241310,0,8.4,"Animation, Action, Adventure","Bob Persichetti, Peter Ramsey, Rodney Rothman","Shameik Moore, Jake Johnson, Hailee Steinfeld",Teen Miles Morales becomes the Spider-Man of his universe and must join with five spider-powered individuals from other dimensions to stop a threat for all realities.,Won 1 Oscar. 85 wins & 60 nominations total,117 min,"Canada, United States","English, Spanish",False,190.24,0.0,,-4.2,2010,2010s
Little Miss Sunshine,2006,4.2,https://letterboxd.com/jack/list/official-top-250-films-with-the-most-fans/,little-miss-sunshine,https://letterboxd.com/film/little-miss-sunshine/,59891098,0,7.8,"Comedy, Drama","Jonathan Dayton, Valerie Faris","Steve Carell, Toni Collette, Greg Kinnear",A family determined to get their young daughter into the finals of a beauty pageant take a cross-country trip in their VW bus.,Won 2 Oscars. 73 wins & 112 nominations total,101 min,United States,English,False,59.89,0.0,,-3.6,2000,2000s
Black Swan,2010,4.2,https://letterboxd.com/jack/list/official-top-250-films-with-the-most-fans/,black-swan,https://letterboxd.com/film/black-swan/,107770258,0,8.0,"Drama, Thriller",Darren Aronofsky,"Natalie Portman, Mila Kunis, Vincent Cassel","Nina is a talented but unstable ballerina on the verge of stardom. Pushed to the breaking point by her artistic director and a seductive rival, Nina's grip on reality slips, plunging her into a waking",Won 1 Oscar. 98 wins & 279 nominations total,108 min,United States,"English, French, Italian",False,107.77,0.0,,-3.8,2010,2010s
Pulp Fiction,1994,4.2,https://letterboxd.com/jack/list/official-top-250-films-with-the-most-fans/,pulp-fiction,https://letterboxd.com/film/pulp-fiction/,107928762,0,8.8,"Crime, Drama",Quentin Tarantino,"John Travolta, Uma Thurman, Samuel L. Jackson","The lives of two mob hitmen, a boxer, a gangster and his wife, and a pair of diner bandits intertwine in four tales of violence and redemption.",Won 1 Oscar. 69 wins & 72 nominations total,154 min,United States,"English, Spanish, French",False,107.93,0.0,,-4.6,1990,1990s
Howl's Moving Castle,2004,4.2,https://letterboxd.com/jack/list/official-top-250-films-with-the-most-fans/,howls-moving-castle,https://letterboxd.com/film/howls-moving-castle/,9173958,0,8.2,"Animation, Adventure, Family",Hayao Miyazaki,"Chieko Baishô, Takuya Kimura, Tatsuya Gashûin","When an unconfident young woman is cursed with an old body by a spiteful witch, her only chance of breaking the spell lies with a self-indulgent yet insecure young wizard and his companions in his leg",Nominated for 1 Oscar. 14 wins & 20 nominations total,119 min,"Japan, United States",Japanese,True,9.17,0.0,,-4.0,2000,2000s
Fantastic Mr. Fox,2009,4.2,https://letterboxd.com/jack/list/official-top-250-films-with-the-most-fans/,fantastic-mr-fox,https://letterboxd.com/film/fantastic-mr-fox/,21002919,0,7.9,"Animation, Adventure, Comedy",Wes Anderson,"George Clooney, Meryl Streep, Bill Murray",An urbane fox cannot resist returning to his farm raiding ways and then must help his community survive the farmers' retaliation.,Nominated for 2 Oscars. 32 wins & 63 nominations total,87 min,"United States, United Kingdom","English, French",True,21.0,0.0,,-3.7,2000,2000s
Call Me by Your Name,2017,4.2,https://letterboxd.com/jack/list/official-top-250-films-with-the-most-fans/,call-me-by-your-name,https://letterboxd.com/film/call-me-by-your-name/,18095701,0,7.8,"Drama, Romance",Luca Guadagnino,"Timothée Chalamet, Armie Hammer, Michael Stuhlbarg","In the summer of 1983, 17-year-old Elio is spending the days with his family at their villa in Lombardy, Italy. He soon meets 24-year-old Oliver, an intern working for Elio's father. They discover the",Won 1 Oscar. 107 wins & 263 nominations total,132 min,"Brazil, France, Italy, United States","English, Italian, French, German, Hebrew",True,18.1,0.0,,-3.6,2010,2010s
Coraline,2009,4.2,https://letterboxd.com/jack/list/official-top-250-films-with-the-most-fans/,coraline,https://letterboxd.com/film/coraline/,116896576,0,7.8,"Animation, Drama, Family",Henry Selick,"Dakota Fanning, Teri Hatcher, John Hodgman","Wandering her rambling old house in her boring new town, a young girl discovers a hidden door to a strangely idealized version of her life that seems too good to be true.",Nominated for 1 Oscar. 8 wins & 46 nominations total,100 min,United States,"English, Russian",False,116.9,0.0,,-3.6,2000,2000s
Scream,1996,4.2,https://letterboxd.com/jack/list/official-top-250-films-with-the-most-fans/,scream,https://letterboxd.com/film/scream/,103046663,0,7.4,"Horror, Mystery",Wes Craven,"Neve Campbell, Courteney Cox, David Arquette",A masked killer targets a past victim's daughter.,12 wins & 11 nominations total,111 min,United States,English,False,103.05,0.0,,-3.2,1990,1990s
The Perks of Being a Wallflower,2012,4.2,https://letterboxd.com/jack/list/official-top-250-films-with-the-most-fans/,the-perks-of-being-a-wallflower,https://letterboxd.com/film/the-perks-of-being-a-wallflower/,17742948,0,7.9,Drama,Stephen Chbosky,"Logan Lerman, Emma Watson, Ezra Miller","Charlie, a 15-year-old introvert, enters high school and is nervous about his new life. When he befriends two seniors, he learns to cope with his friend's suicide and his tumultuous past.",20 wins & 51 nominations total,103 min,United States,English,True,17.74,0.0,,-3.7,2010,2010s
10 Things I Hate About You,1999,4.2,https://letterboxd.com/jack/list/official-top-250-films-with-the-most-fans/,10-things-i-hate-about-you,https://letterboxd.com/film/10-things-i-hate-about-you/,38178166,0,7.4,"Comedy, Drama, Romance",Gil Junger,"Heath Ledger, Julia Stiles, Joseph Gordon-Levitt","A high-school boy, Cameron, cannot date Bianca until her anti-social older sister, Kat, has a boyfriend. So, Cameron pays a mysterious boy, Patrick, to charm Kat.",2 wins & 13 nominations total,97 min,United States,"English, French",True,38.18,0.0,,-3.2,1990,1990s
